{
  "name": "QwenPaw System Architecture",
  "description": "Intent architecture for QwenPaw covering the current platform slices plus the strengthened P0 local security audit foundation required for end-to-end non-repudiation, tamper-evident auditing, external checkpoint anchoring, out-of-band configuration tamper detection, tiered audit durability, replay-resistant cloud reconciliation, and behavior-level anomaly detection. The security extension is scoped from the AgentScope security infrastructure PRD and is intentionally limited to the minimum business closure needed for four core business scenarios and three deep-risk scenarios: full-chain evidence continuity, audit-integrity self-healing lock mode, bounded TTFT impact under full audit mode, lease-expiry-driven active defense, prompt-injection-resistant tool enforcement, stolen-session replay blocking, and silent exfiltration pattern alerting.",
  "standard": {
    "name": "ArchiMate",
    "version": "3.2",
    "profile": "QwenPaw repository intent knowledge graph"
  },
  "attributes": [
    {
      "name": "evidence_policy",
      "value": "repository-current-state-plus-prd-scoped-security-foundation"
    }
  ],
  "elements": [
    {
      "id": "intent-qwenpaw-platform",
      "name": "QwenPaw Platform",
      "type": "Product",
      "archimate_layer": "Business",
      "archimate_aspect": "Composite",
      "browser_path": "QwenPaw Platform",
      "description": "Repository-backed personal AI assistant platform spanning backend runtime, local operator CLI, operator console, documentation website, architecture validation assets, and the P0 security audit foundation required for local safe operation.\n#file:README.md\n#file:pyproject.toml\n#file:design/prd/企业级个人助理平台安全基础设施设计方案 (基于 QwenPaw/AgentScope.md"
    },
    {
      "id": "intent-backend-runtime",
      "parent": "intent-qwenpaw-platform",
      "name": "Backend Runtime",
      "type": "Application Component",
      "archimate_layer": "Application",
      "archimate_aspect": "Active Structure",
      "browser_path": "QwenPaw Platform/Backend Runtime",
      "description": "Python runtime root that owns API routers, agent execution, channels, config, security, providers, and shared utilities.\n#file:src/qwenpaw\n#file:tests/unit/routers/test_settings.py\n#file:tests/unit/routers/test_git.py"
    },
    {
      "id": "intent-local-security-audit-foundation",
      "parent": "intent-backend-runtime",
      "name": "Local Security Audit Foundation",
      "type": "Application Component",
      "archimate_layer": "Application",
      "archimate_aspect": "Active Structure",
      "browser_path": "QwenPaw Platform/Backend Runtime/Local Security Audit Foundation",
      "description": "Backend-owned P0 security foundation that standardizes implicit SecurityContext propagation, defines the canonical AuditEvent envelope, persists append-only local audit records with a hash chain, anchors continuity through a restricted checkpoint store, verifies startup consistency against configuration hashes, enforces security lock mode after integrity failures, supports human-in-the-loop confirmation for high-risk tool execution, resists prompt-driven guard bypass at the tool-call layer, and supports tiered audit durability for critical versus informational events. This element is intentionally limited to the minimum closure needed for end-to-end non-repudiation evidence chains, audit-integrity self-healing lock mode, bounded TTFT impact, active liveness defense, replay-resistant session continuity, and behavior-anomaly evidence generation rather than the full later audit pipeline.\n#file:design/prd/企业级个人助理平台安全基础设施设计方案 (基于 QwenPaw/AgentScope.md\n#file:src/qwenpaw/app/auth.py\n#file:src/qwenpaw/app/agent_context.py\n#file:src/qwenpaw/app/runner/utils.py\n#file:src/qwenpaw/app/routers/config.py\n#file:src/qwenpaw/app/routers/settings.py\n#file:src/qwenpaw/security",
      "attributes": [
        {
          "name": "verification_focus",
          "value": "end-to-end actor trace continuity, tamper-evident and self-healing audit integrity, accountable security configuration changes, prompt-injection-resistant high-risk enforcement, replay-resistant session continuity, behavior-level anomaly surfacing, and bounded full-audit latency"
        },
        {
          "name": "scope_limit",
          "value": "P0 covers implicit context propagation via contextvars, local append-only audit write, checkpoint-anchored hash continuity, configuration-hash consistency verification, security lock mode, basic query, approval persistence, human-in-the-loop confirmation records for high-risk tool execution, tool-layer enforcement against prompt-driven bypass attempts, tiered L1/L2 audit write semantics, asynchronous uplink of critical audit anchors to the cloud situational awareness platform for remote integrity mirroring, and cloud-visible anomaly evidence for replay or silent exfiltration patterns; session encryption remains later phases."
        },
        {
          "name": "context_propagation_rule",
          "value": "SecurityContext must not be architecture-visible as an explicit function parameter; request entry and message dispatch must rely on implicit contextvars capture and restoration."
        },
        {
          "name": "checkpoint_rule",
          "value": "A restricted append-only checkpoint store must anchor latest anchored_event_id and global_hash every N events and on each high-risk configuration change so tail truncation is detectable on restart."
        },
        {
          "name": "lock_mode_rule",
          "value": "If startup consistency verification detects settings or audit-anchor divergence, backend runtime enters security lock mode and refuses sensitive tool loading until trust is re-established."
        },
        {
          "name": "ledger_integrity_verification_rule",
          "value": "Audit integrity verification must cover the committed audit ledger, not only checkpoint-file presence. Editing, deleting, reordering, or truncating any already-written audit record, including a non-tail record after several high-risk actions, is a tamper signal that must be detected no later than the next high-risk tool boundary or startup/reconnect preflight."
        },
        {
          "name": "security_center_recovery_display_rule",
          "value": "After audit-ledger tamper is detected, Security Center backend and operator web must keep the affected canonical client in UNTRUSTED or equivalent recovery-required state until full-chain validation against the cloud mirror succeeds; a CLEAR display before that validation is a security failure."
        },
        {
          "name": "audit_tiering_rule",
          "value": "L1 critical events use synchronous durable write plus hash-chain and checkpoint updates before returning; L2 informational reasoning events may batch asynchronously and remain visible as pending verification until anchored."
        },
        {
          "name": "uplink_rule",
          "value": "Critical audit anchors and L1 audit records must be asynchronously uplinked with retry to a cloud integrity mirror; before sending new data after reconnect, the client must perform a pre-upload hash-alignment handshake and refuse sync if local and cloud anchors diverge."
        },
        {
          "name": "high_risk_confirmation_rule",
          "value": "High-risk tool execution must pause for explicit user confirmation, persist the confirmation artifact, and emit a synchronous L1 USER_CONFIRMATION audit record before execution resumes."
        },
        {
          "name": "tool_layer_enforcement_rule",
          "value": "High-risk enforcement must execute at the tool invocation boundary rather than trusting conversational intent classification; prompts that claim test mode, maintenance mode, or other bypass narratives cannot suppress guard evaluation when the tool risk remains High."
        },
        {
          "name": "session_replay_rule",
          "value": "Cloud-side reconciliation must validate that each trusted trace or session advances through the expected monotonic sequence and hash continuity. A replayed or cloned session presented from an unaudited process must be blocked before additional actions are authorized."
        },
        {
          "name": "trust_recovery_rule",
          "value": "Whenever a client resumes from UNTRUSTED state, it must perform a mandatory full-chain sync for the missing sequence gap. No new high-risk tools are permitted until the gap is validated by the cloud mirror."
        },
        {
          "name": "recovery_release_rule",
          "value": "For a lease-expired or otherwise UNTRUSTED canonical client, successful full-chain missing-gap validation by the cloud mirror must close the recovery gate and restore normal model access for that same client. Continuing to project UNTRUSTED or return recovery-gated model-access denial after valid proof is a security availability failure; restoring access before valid proof remains a security integrity failure."
        },
        {
          "name": "normal_offline_reconnect_rule",
          "value": "A normally stopped or briefly offline canonical client whose local audit head still matches the cloud shadow, has no tamper evidence, has no missing sequence, and has not crossed the lease-expiry recovery boundary must be admitted as normal continuity on reconnect. Security Center backend and operator web must project ALIGNED or TRUSTED with gap_status CLEAR, recovery_gate_status CLEAR, and recovery_required false. If the lease did expire, the client may require full-chain missing-gap validation, but once a valid locally constructible proof is accepted the state must clear; a persistent GAP_VALIDATION_REQUIRED/REQUIRED/OPEN display after normal proof acceptance is an availability failure."
        }
      ],
      "testcases": [
        {